{
  "last_updated": "2025-11-08T00:00:00Z",
  "source": "official",
  "version": "1.0.0",
  "applications": [
    {
      "id": "vscode-online",
      "name": "Visual Studio Code",
      "type": "online",
      "download_url": "https://code.visualstudio.com/sha/download?build=stable&os=win32-x64-user",
      "version": "latest",
      "silent_args": ["/VERYSILENT", "/NORESTART", "/MERGETASKS=!runcode"],
      "fallback_args": ["/SILENT"],
      "launch_argument_template_id": "innosetup-standard",
      "script": null,
      "uninstall_script": null,
      "uninstall_command": null,
      "checksum": null,
      "notes": "Code editor - InnoSetup installer",
      "include_in_build": false,
      "allow_manual_install": true
    },
    {
      "id": "steam-online",
      "name": "Steam",
      "type": "online",
      "download_url": "https://cdn.fastly.steamstatic.com/client/installer/SteamSetup.exe",
      "version": "latest",
      "silent_args": ["/S"],
      "fallback_args": ["/silent"],
      "launch_argument_template_id": "nsis-standard",
      "script": null,
      "uninstall_script": null,
      "uninstall_command": null,
      "checksum": null,
      "notes": "Gaming platform - NSIS installer",
      "include_in_build": false,
      "allow_manual_install": true
    },
    {
      "id": "epic-games-online",
      "name": "Epic Games Launcher",
      "type": "online",
      "download_url": "https://launcher-public-service-prod06.ol.epicgames.com/launcher/api/installer/download/EpicGamesLauncherInstaller.msi",
      "version": "latest",
      "silent_args": ["/quiet", "/norestart"],
      "fallback_args": ["/qn"],
      "launch_argument_template_id": "msi-standard",
      "script": null,
      "uninstall_script": null,
      "uninstall_command": null,
      "checksum": null,
      "notes": "Epic Games Store - MSI installer",
      "include_in_build": false,
      "allow_manual_install": true
    },
    {
      "id": "ea-desktop-online",
      "name": "EA Desktop",
      "type": "online",
      "download_url": "https://origin-a.akamaihd.net/EA-Desktop-Client-Download/installer-releases/EAappInstaller.exe",
      "version": "latest",
      "silent_args": ["/silent"],
      "fallback_args": ["/S"],
      "launch_argument_template_id": "generic-silent",
      "script": null,
      "uninstall_script": null,
      "uninstall_command": null,
      "checksum": null,
      "notes": "EA Games launcher",
      "include_in_build": false,
      "allow_manual_install": true
    },
    {
      "id": "fdm-online",
      "name": "Free Download Manager",
      "type": "online",
      "download_url": "https://files2.freedownloadmanager.org/6/latest/fdm_x64_setup.exe",
      "version": "latest",
      "silent_args": ["/VERYSILENT", "/NORESTART"],
      "fallback_args": ["/SILENT"],
      "launch_argument_template_id": "innosetup-standard",
      "script": null,
      "uninstall_script": null,
      "uninstall_command": null,
      "checksum": null,
      "notes": "Download manager",
      "include_in_build": false,
      "allow_manual_install": true
    },
    {
      "id": "github-desktop-online",
      "name": "GitHub Desktop",
      "type": "online",
      "download_url": "https://central.github.com/deployments/desktop/desktop/latest/win32",
      "version": "latest",
      "silent_args": ["--silent"],
      "fallback_args": ["/S"],
      "launch_argument_template_id": "generic-silent",
      "script": null,
      "uninstall_script": null,
      "uninstall_command": null,
      "checksum": null,
      "notes": "GitHub desktop client",
      "include_in_build": false,
      "allow_manual_install": true
    },
    {
      "id": "discord-online",
      "name": "Discord",
      "type": "online",
      "download_url": "https://discord.com/api/download?platform=win",
      "version": "stable",
      "silent_args": ["/S"],
      "fallback_args": ["/silent"],
      "launch_argument_template_id": "nsis-standard",
      "script": null,
      "uninstall_script": null,
      "uninstall_command": null,
      "checksum": null,
      "notes": "Voice and text chat - Stable release",
      "include_in_build": false,
      "allow_manual_install": true
    },
    {
      "id": "discord-ptb-online",
      "name": "Discord PTB",
      "type": "online",
      "download_url": "https://ptb.discord.com/api/downloads/distributions/app/installers/latest?channel=ptb&platform=win&arch=x64",
      "version": "ptb",
      "silent_args": ["/S"],
      "fallback_args": ["/silent"],
      "launch_argument_template_id": "nsis-standard",
      "script": null,
      "uninstall_script": null,
      "uninstall_command": null,
      "checksum": null,
      "notes": "Discord Public Test Build",
      "include_in_build": false,
      "allow_manual_install": true
    },
    {
      "id": "virtual-desktop-online",
      "name": "Virtual Desktop Streamer",
      "type": "online",
      "download_url": "https://files.vrdesktop.net/files/VirtualDesktop.Streamer.Setup.exe",
      "version": "latest",
      "silent_args": ["/S"],
      "fallback_args": ["/silent"],
      "launch_argument_template_id": "nsis-standard",
      "script": null,
      "uninstall_script": null,
      "uninstall_command": null,
      "checksum": null,
      "notes": "VR desktop streaming",
      "include_in_build": false,
      "allow_manual_install": true
    },
    {
      "id": "dcs-world-online",
      "name": "DCS World",
      "type": "online",
      "download_url": "https://www.digitalcombatsimulator.com/upload/iblock/959/d33ul8g3arxnzc1ejgdaa8uev8gvmew2/DCS_World_web.exe",
      "version": "latest",
      "silent_args": ["/S"],
      "fallback_args": ["/silent"],
      "launch_argument_template_id": "nsis-standard",
      "script": null,
      "uninstall_script": null,
      "uninstall_command": null,
      "checksum": null,
      "notes": "Digital Combat Simulator",
      "include_in_build": false,
      "allow_manual_install": true
    },
    {
      "id": "process-lasso-online",
      "name": "Process Lasso",
      "type": "online",
      "download_url": "https://dl.bitsum.com/files/processlassosetup64.exe",
      "version": "latest",
      "silent_args": ["/S"],
      "fallback_args": ["/VERYSILENT"],
      "launch_argument_template_id": "nsis-standard",
      "script": null,
      "uninstall_script": null,
      "uninstall_command": null,
      "checksum": null,
      "notes": "Process optimization tool",
      "include_in_build": false,
      "allow_manual_install": true
    },
    {
      "id": "mobaxterm-online",
      "name": "MobaXterm",
      "type": "online",
      "download_url": "https://download.mobatek.net/2532025092512146/MobaXterm_Installer_v25.3.zip",
      "version": "25.3",
      "silent_args": ["/S"],
      "fallback_args": ["/VERYSILENT"],
      "launch_argument_template_id": "nsis-standard",
      "script": null,
      "uninstall_script": null,
      "uninstall_command": null,
      "checksum": null,
      "notes": "SSH/X11 terminal - ZIP archive contains installer",
      "include_in_build": false,
      "allow_manual_install": true
    },
    {
      "id": "teamspeak3-online",
      "name": "TeamSpeak 3 Client",
      "type": "online",
      "download_url": "https://files.teamspeak-services.com/releases/client/3.6.2/TeamSpeak3-Client-win64-3.6.2.exe",
      "version": "3.6.2",
      "silent_args": ["/S"],
      "fallback_args": ["/silent"],
      "launch_argument_template_id": "nsis-standard",
      "script": null,
      "uninstall_script": null,
      "uninstall_command": null,
      "checksum": null,
      "notes": "Voice chat client",
      "include_in_build": false,
      "allow_manual_install": true
    },
    {
      "id": "obs-studio-online",
      "name": "OBS Studio",
      "type": "online",
      "download_url": "https://cdn-fastly.obsproject.com/downloads/OBS-Studio-32.0.2-Windows-x64.zip",
      "version": "32.0.2",
      "silent_args": ["/S"],
      "fallback_args": ["/VERYSILENT"],
      "launch_argument_template_id": "nsis-standard",
      "script": null,
      "uninstall_script": null,
      "uninstall_command": null,
      "checksum": null,
      "notes": "Streaming and recording software - ZIP archive contains installer",
      "include_in_build": false,
      "allow_manual_install": true
    },
    {
      "id": "cpuz-online",
      "name": "CPU-Z",
      "type": "online",
      "download_url": "https://download.cpuid.com/cpu-z/cpu-z_2.17-en.zip",
      "version": "2.17",
      "silent_args": ["/S"],
      "fallback_args": ["/silent"],
      "launch_argument_template_id": "nsis-standard",
      "script": null,
      "uninstall_script": null,
      "uninstall_command": null,
      "checksum": null,
      "notes": "CPU information utility - ZIP archive",
      "include_in_build": false,
      "allow_manual_install": true
    },
    {
      "id": "ultimaker-cura-online",
      "name": "UltiMaker Cura",
      "type": "online",
      "download_url": null,
      "version": "latest",
      "silent_args": ["/S"],
      "fallback_args": ["/VERYSILENT"],
      "launch_argument_template_id": "nsis-standard",
      "script": null,
      "uninstall_script": null,
      "uninstall_command": null,
      "checksum": null,
      "notes": "3D printing slicer software - Dynamically fetches latest from GitHub",
      "include_in_build": false,
      "allow_manual_install": true,
      "github_owner": "Ultimaker",
      "github_repo": "Cura",
      "github_asset_pattern": "win64-X64.exe"
    },
    {
      "id": "nvidia-app-driver",
      "name": "NVIDIA App",
      "type": "online",
      "download_url": "https://us.download.nvidia.com/nvapp/client/11.0.5.266/NVIDIA_app_v11.0.5.266.exe",
      "version": "11.0.5.266",
      "silent_args": ["/s", "/noreboot"],
      "fallback_args": ["/S"],
      "launch_argument_template_id": "generic-silent",
      "script": null,
      "uninstall_script": null,
      "uninstall_command": null,
      "checksum": null,